{
  "$schema": "./project.config.schema.json",
  "schemaVersion": 2,
  "template": {
    "name": "adminback-template",
    "version": "0.2.5",
    "repository": "https://github.com/shen-kk/create-ai-fullstack"
  },
  "project": {
    "name": "adminback-template",
    "packageScope": "@template",
    "displayName": "AI 友好全栈模板",
    "description": "可复用的后台管理、用户端与 API 项目模板"
  },
  "runtime": {
    "packageManager": "pnpm",
    "adminPort": 3000,
    "apiPort": 3001,
    "webPort": 3002
  },
  "database": {
    "mode": "prisma",
    "engine": "postgresql",
    "orm": "prisma"
  },
  "localization": {
    "defaultLocale": "zh-CN",
    "supportedLocales": [
      "zh-CN"
    ]
  },
  "ui": {
    "web": {
      "businessComponents": "shadcn-vue",
      "motion": "vueuse-motion",
      "orchestration": "gsap",
      "designStandard": "project-defined"
    }
  },
  "features": [
    "customerWeb"
  ],
  "modules": {
    "authentication": true,
    "customerAuthentication": true,
    "userWeb": true,
    "adminUsers": true,
    "rolesAndPermissions": true,
    "auditLogs": true,
    "serviceConfig": true,
    "deploymentCenter": true,
    "objectStorage": true,
    "redis": true,
    "sms": true,
    "email": true,
    "payment": false
  },
  "providers": {
    "objectStorage": "resource_library"
  }
}
